{
  "version": "0.1.0",
  "project_id": "heavenzfire-unified-field",
  "source_platform": "chatgpt",
  "conversation_reference": {
    "share_url": null,
    "local_id": "chatgpt_current_session",
    "retrievable": false,
    "last_verified_message": "Meta AI T-001/T-002/T-003 capability audit handoff received"
  },
  "objective": "Continue engineering HeavenzFire Unified Field as a real, testable, local-first agent framework with principled cross-platform interoperability, bounded micro-sandboxes, explicit capability declarations, portable evidence, and user-controlled authorization.",
  "decisions": [
    {
      "id": "D-001",
      "statement": "Use file-based JSON interchange as the primary portable cross-AI mechanism; never infer API access from a share URL.",
      "timestamp": "2026-10-21T00:00:00Z",
      "status": "accepted"
    },
    {
      "id": "D-002",
      "statement": "Capability declarations must be evidence-backed and tool-specific; dedicated web browsing is distinct from arbitrary network access in code execution.",
      "timestamp": "2026-10-22T00:00:00Z",
      "status": "accepted"
    },
    {
      "id": "D-003",
      "statement": "Consolidate repositories through inventory, source comparison, explicit canonical boundaries, reversible pull requests, and preserved history; do not mass-merge by name or README similarity.",
      "timestamp": "2026-10-22T00:00:00Z",
      "status": "accepted"
    }
  ],
  "task_status": [
    {
      "task_id": "T-001",
      "title": "Determine cross-AI import/export mechanisms supported",
      "status": "verified_for_chatgpt_capability_entry",
      "evidence": "chatgpt_capability_registry_entry_v0.1.0.json",
      "owner": "chatgpt"
    },
    {
      "task_id": "T-002",
      "title": "Validate imported Meta AI schema and example",
      "status": "blocked_missing_artifacts",
      "evidence": null,
      "owner": "chatgpt",
      "note": "The schema/example files referenced under Meta AI /mnt/data/heavenzfire/ were not attached or otherwise accessible in this ChatGPT session."
    },
    {
      "task_id": "T-003",
      "title": "Run Meta AI test_interchange.py",
      "status": "blocked_missing_artifacts",
      "evidence": null,
      "owner": "chatgpt",
      "note": "The original test file and execution log were not present in the accessible files for this turn; the five Meta AI passes are accepted as reported, not independently reproduced."
    },
    {
      "task_id": "T-004",
      "title": "Publish evidence-scoped ChatGPT capability entry and refresh export",
      "status": "completed_with_limitations",
      "evidence": "interchange/registries/chatgpt_capability_registry_entry_v0.1.0.json sha256:223f987d82e806f6d42caadc2c0d93f75817002d7f69117008f1ef8c927421de",
      "owner": "chatgpt"
    },
    {
      "task_id": "T-005",
      "title": "Start preservation-first repository consolidation",
      "status": "in_progress",
      "evidence": "https://github.com/HeavenzFire/HeavenzFire/pull/79",
      "owner": "chatgpt",
      "note": "Draft PR inventories 277 repositories returned by GitHub search and records a bounded content audit; source migration has not yet occurred."
    }
  ],
  "artifacts": [
    {
      "artifact_id": "A-CHATGPT-001",
      "type": "capability-registry-entry",
      "path": "interchange/registries/chatgpt_capability_registry_entry_v0.1.0.json",
      "sha256": "223f987d82e806f6d42caadc2c0d93f75817002d7f69117008f1ef8c927421de"
    }
  ],
  "test_results": [
    {
      "test_id": "test_registry_entry_json_parses",
      "passed": true,
      "output": "PASS — valid JSON"
    },
    {
      "test_id": "test_export_json_parses",
      "passed": true,
      "output": "PASS — valid JSON and required fields present"
    },
    {
      "test_id": "test_capability_dimensions_are_separate",
      "passed": true,
      "output": "PASS — file_write, code_exec, browsing, network, and share_url_fetch separately declared"
    },
    {
      "test_id": "test_share_url_not_treated_as_api",
      "passed": true,
      "output": "PASS — share_url is null; retrievable is false; no fetch claim"
    },
    {
      "test_id": "test_sensitive_actions_require_authorization",
      "passed": true,
      "output": "PASS — explicit authorization constraint present"
    },
    {
      "test_id": "test_meta_interchange_schema_validation",
      "passed": false,
      "output": "BLOCKED — exact interchange_schema_v0.1.0.json unavailable"
    },
    {
      "test_id": "test_original_test_interchange_py",
      "passed": false,
      "output": "BLOCKED — original test suite unavailable"
    }
  ],
  "next_actions": [
    {
      "action": "Locate or provide the exact interchange_schema_v0.1.0.json, interchange_example_v0.1.0.json, and test_interchange.py; validate against those exact artifacts.",
      "requires_auth": false,
      "assignee": "chatgpt"
    },
    {
      "action": "Have each participating AI publish a capability registry entry with evidence, then compare results without assuming equivalent execution/network permissions.",
      "requires_auth": false,
      "assignee": "heavenzfire"
    },
    {
      "action": "Continue repository source/tree/license/test audits before proposing code migration.",
      "requires_auth": false,
      "assignee": "chatgpt"
    }
  ],
  "permissions": {
    "allow_network": false,
    "allow_code_exec": true,
    "allow_file_write": true,
    "sensitive_actions_require_explicit_auth": true,
    "allow_github_operations_when_authorized": true
  },
  "timestamp": "2026-10-22T00:00:00Z"
}
